article_id,article_title,article_summary,skip_forwards,skip_backwards,average_skip_perc,listens,unique_users,saves,archives
2b733ba6-44a9-4591-8c0c-816d3e8c4a91,"Sudan: more than a million people have fled ‘spiralling’ conflict, says UN | Sudan | The Guardian","More than 1 million people have fled Sudan to neighboring countries due to a lack of food and healthcare caused by four months of war. The fighting between the Sudanese army and the paramilitary Rapid Support Forces (RSF) has devastated the capital Khartoum and sparked ethnically driven attacks in Darfur. The situation is spiraling out of control, with farmers running out of time to plant crops and medical supplies becoming scarce. The war has caused over 1 million people to cross into neighboring countries, while an estimated 3.4 million people have been displaced within Sudan itself. The conflict began in April over tensions linked to a planned transition to civilian rule, exposing civilians to daily battles and attacks. The UN estimates that over 4,000 people have been killed, and reports of sexual assaults have increased by 50%. Large parts of the country have also been suffering from an electricity blackout and mobile network outages.",0,0,0.0,1,1,0,0
ee411cc5-b516-4115-8b4a-ef96dbda9d5a,North Korea claims US soldier crossed over as he was ‘disillusioned by society’ | US news | The Guardian,"North Korea has claimed that the US soldier who crossed over into North Korea last month did so because he was disillusioned by the inequality of American society. This is the first official confirmation of the detention of Private 2nd class Travis King, who entered North Korea while on a tour of a border village on July 18th. The North Korean official news agency, KCNA, reported that King confessed to entering North Korea because he harbored ill feelings against mistreatment and racial discrimination within the US army. He expressed his willingness to seek refuge in North Korea or a third country, stating that he was disillusioned by the unequal American society. The Pentagon stated that it could not verify King's alleged comments, but their priority is to bring him home safely. Analysts believe that North Korea may try to use King's case to gain concessions from the US.",1,0,0.25102782537863,0,1,0,0
c8429fcc-2877-4b60-b67f-5ac2756c9319,Janet Yellen inadvertently ate hallucinogenic mushrooms in China – and started a trend | Janet Yellen | The Guardian,"US Treasury Secretary Janet Yellen unintentionally ate hallucinogenic mushrooms while in China and unknowingly started a trend. Yellen was spotted eating the mushrooms, known for their hallucinogenic properties, during a visit to Beijing in July. The dish, called Jian shou qing or see hand blue, is made from Lanmaoa asiatica mushrooms, which turn blue when bruised or sliced. While the mushrooms are considered poisonous and can be hallucinogenic, scientists have not yet identified the compounds responsible for the hallucinations. Yellen's trip to China was the first by a top US official in over three years, and she praised it for improving US ties with China. After a Weibo user posted about Yellen's meal at a Yunnan restaurant, a hashtag about her first meal in Beijing started trending online. Yellen confirmed that she and her group enjoyed the mushrooms and experienced no ill-effects from eating them.",1,0,,0,1,0,0
e851e1bd-ea5c-4105-bc60-2baa940da839,The mystery of the Crooked House fire | News | The Guardian,"The Crooked House, a historic building in England, was destroyed in a fire. The cause of the fire remains a mystery. The building, which was built in 1795, was known for its unique architectural design and had been a popular tourist attraction. The fire started in the early morning and quickly spread, engulfing the entire structure. Firefighters were unable to save the building, but were able to prevent the fire from spreading to nearby homes. The owner of the Crooked House, who had been renovating the building, expressed shock and sadness at the loss. The fire is being investigated, but so far no cause has been determined. The loss of the Crooked House has left the community devastated and mourning the loss of a piece of their history.",1,0,0.346482250019329,0,1,0,0
7f5f102c-d292-4497-9467-787f5418b7e9,Twitter appears to delay links by five seconds to sites Elon Musk dislikes | Twitter | The Guardian,"Twitter has been accused of delaying links to websites disliked by Elon Musk. The social media platform reportedly applied a five-second delay, known as throttling, to sites including the New York Times, Reuters, Instagram, and Blue Sky. The delayed links also included competitors to Twitter and news publications that have been critical of Musk. When users clicked on these links, they were directed to a blank screen for a few seconds before gaining access to the site. The delay seemed to only affect links processed through t.co, Twitter's link abbreviation service. The issue appeared to be resolved later in the day, with links opening within a second of clicking. This incident is the latest in a series of clashes between Musk and the media, with Twitter previously labeling the BBC and NPR as ""state-affiliated media"" and marking links to Substack as unsafe. Twitter, now known as X, has not provided a comment on the matter.",1,0,0.06818519587753483,0,1,0,0
eb0055e1-7cc2-43d1-a3ff-0d8c3f40f20f,Booing and walkouts after the Killers tell Georgia audience Russian is their ‘brother’ | Georgia | The Guardian,"The Killers faced backlash during a concert in Georgia after lead singer Brandon Flowers invited a Russian fan onstage and referred to the audience as brothers and sisters. The concert took place in Batumi, Georgia, the former Soviet state that was invaded by Russia in 2008. Flowers introduced the Russian fan and asked the crowd if they were okay with him being on stage, which received mixed reactions of cheers and boos. After the song, Flowers addressed the incident and asked if people couldn't recognize someone as their brother, urging the audience to celebrate being together. Many people reportedly left the stadium in protest, but The Killers continued to play until the end of the show. Russia still occupies 20% of Georgian territory since the invasion in 2008, and there has been an increase in Russian presence in Georgia since Russia's war on Ukraine began in 2022.",1,0,0.27933251870103165,0,1,0,0
49cdbf00-45d6-4b7e-b80c-ca78c8aaf30d,"Russia-Ukraine war live: drones destroyed over Russia’s Kaluga region, says Moscow; US pressing Iran to halt drone sales – report | Russia | The Guardian","Russia's air defense systems destroyed three Ukrainian drones over the Kaluga region, according to the Russian defense ministry. The US is pressuring Iran to halt drone sales to Russia as part of discussions on an unwritten understanding between Washington and Tehran. In Ukraine, a large-scale air attack on the western region of Lviv and the northwestern region of Volyn resulted in three deaths, several injuries, and damage to buildings. The mayor of Lviv ordered the evacuation of at least one burning apartment building. The attack occurred just before a security conference in Moscow, attended by top Russian military officials and counterparts from allied countries in Asia, the Middle East, and Africa. The Bank of Russia raised its key rate from 8.5% to 12%, but did not mention the declining value of the rouble.",0,0,0.0,1,1,0,0
a3b0f3d5-b4e1-4cc0-9a76-051d0c633513,Teen who fell from Grand Canyon ledge says he was ‘inches away from death’ | US news | The Guardian,"A 13-year-old boy named Wyatt Kauffman fell 100ft from a ledge at the Grand Canyon and said he was inches away from death. He suffered a spinal fracture and other injuries but is expected to make a full recovery. Wyatt spent four days in the hospital before being discharged. Due to his condition, he was unable to fly back home to North Dakota, so he and his mother had to drive instead. Wyatt was taking pictures at the top of the Bright Angel Point trail when he lost his grip and fell. He doesn't remember anything after that until he woke up in an ambulance. It took rescue crews two hours to retrieve him using ropes and a Stokes basket. He was then flown to a pediatric trauma center in Las Vegas for treatment. Despite his injuries, Wyatt is expected to fully recover.",1,0,0.13007937927047528,0,1,0,0
75633a66-e738-45d6-80df-3dee04186811,"‘Donair’ fast-food costume fetches more than $16,000 in Canada auction | Canada | The Guardian","A donair mascot costume recently sold for over $16,000 in a Canadian auction. The bidding war was sparked by a disagreement over the inclusion of lettuce in the donair, a Canadian version of the gyros or döner kebab. Adil Asim, owner of PrimeTime Donair and Poutine in Edmonton, was motivated to bid on the costume after hearing that some donair shops in the Maritimes would remove the lettuce if they had won. Asim, a long-time donair enthusiast, wanted to ensure that the costume remained true to the Alberta tradition of including lettuce in their donairs. The costume was originally commissioned by the province of Alberta for a traffic safety video campaign, but the ad was never released, and the costume was put into storage. The 56-inch tall costume was created by puppet designers Christine Papalexis and Bill Bryan, known for their work on the Marshmallow Man costume from Ghostbusters.",1,0,0.628492221965894,0,1,0,0
dfa33b15-c06e-4d68-b035-795d32675272,Brazil inquiry into alleged Bolsonaro-era pilfering of official gifts widens | Brazil | The Guardian,"An inquiry in Brazil into the alleged pilfering of official gifts during Jair Bolsonaro's presidency has expanded. Close associates of Bolsonaro and possibly Bolsonaro himself have been accused of selling expensive gifts, including a diamond-set Rolex watch, given to the former president. The scandal first came to light in March, when it was reported that customs officials had confiscated a pair of diamond earrings that a military official had tried to import without declaring. The jewellery was supposedly a gift for Bolsonaro's wife from Saudi Arabia. Federal police have now requested access to Bolsonaro's banking records, suspecting that his inner circle had been selling off official gifts, including the Rolex, after taking them out of Brazil on the presidential jet. The Rolex and another watch, reportedly given to Bolsonaro by Bahrain, have allegedly been sold at a US watch-dealer. A set of Chopard jewellery from Saudi Arabia was also put up for sale but failed to find a buyer. Bolsonaro and his family deny any wrongdoing.",1,0,0.10125970973161823,0,1,0,0
25e3c7cc-af0b-4dad-8eb7-b3c182b27f30,"Charred debris, toxic water, remote towns: Lahaina’s recovery will be a ‘slow process’ | Hawaii fires | The Guardian","The recovery process for Lahaina, a town in Maui, Hawaii, will be slow and challenging after devastating wildfires destroyed roughly 2,700 buildings and claimed at least 101 lives. The focus is currently on search and rescue efforts to recover bodies and provide relief for displaced survivors. However, before communities can begin to heal, tons of charred debris will need to be removed from the island. The cleanup process is expected to be daunting, costly, and time-consuming, potentially taking years. The logistical challenges are exacerbated by the presence of hazardous materials such as asbestos, lead paint, and arsenic, which were used in old buildings and plantations. The smoke from the fires also likely left behind harmful chemicals that could contaminate water systems and cling to fabrics. Finding a suitable location to transport and dispose of the toxic material will be a significant challenge for the island. Additionally, Hawaii lacks the experience and capacity to handle large-scale disaster recoveries like this.",1,0,0.04152297642750607,0,1,0,0
cb314895-ad60-4100-a46e-f606e32c4566,From Sound of Freedom to Ron DeSantis: how QAnon’s crazy conspiracy theories went mainstream | QAnon | The Guardian,"The Guardian article discusses the mainstreaming of QAnon conspiracy theories. Although the movement itself may have become quieter, its ideas have permeated public discourse. The article highlights how conspiracy theories tend to turn tragedy into fodder for their narratives. For example, the drowning of Barack Obama's chef was immediately seized upon by conspiracists as proof of an assassination plot involving the Obamas. The article explains that QAnon emerged in 2017 and quickly spread through the far right, but its popularity waned after Joe Biden's inauguration. However, it has not disappeared entirely. The article argues that understanding the rise and fall of QAnon reveals a lot about the current landscape of partisan paranoia and offers insights on how to combat it. QAnon originated on the anonymous forum 4chan, with a figure known as Q claiming to be a high-level intelligence officer. The article concludes by emphasizing the need to address and challenge conspiracy theories like QAnon.",1,0,0.08461694604140994,0,1,0,0
6f3d33cf-ffcd-458c-9aef-c444a014956e,"Trump’s free-speech defense in January 6 case is danger to democracy, experts say | Donald Trump | The Guardian","Experts are warning that former President Donald Trump's defense that he was exercising his free-speech rights in response to a federal indictment is a danger to democracy. Trump is facing charges for pushing illegal schemes to overturn the 2020 election results. Despite the detailed indictment against him, Trump and his allies have portrayed his actions as a matter of free speech. However, former Department of Justice officials, scholars, and ex-Republican House members argue that Trump's actions went beyond free speech and are weakening the justice system. They also warn that embracing Trump's free-speech claims could lead to the spread of new conspiracy theories. Critics believe that Trump's allies are using the defense to appeal to the party's base and justify their support for him. The indictment against Trump includes evidence of his active role in illegal attempts to overturn the election, despite no evidence of widespread fraud. Trump's lawyer has claimed that the charges are an attack on free speech, but experts argue that this is a distortion and a threat to the legal system's integrity.",0,0,0.0,1,1,0,0
71f927cb-98b5-4211-8f52-a9571292be1d,‘Laboratories of success’: why HBCUs are the best models for race-blind admissions | US universities | The Guardian,"Historically Black colleges and universities (HBCUs) have long provided educational access to students who were once excluded from white institutions. Despite the introduction of affirmative action policies, HBCUs have remained important for Black students. However, with the recent Supreme Court decision striking down affirmative action, some experts argue that HBCUs could serve as models for race-blind admissions. HBCUs have a history of valuing inclusion and welcoming students from diverse backgrounds. They have a higher percentage of non-Black students compared to the past, with a quarter of students in 2021 being non-Black. HBCUs also enroll more students from low-income backgrounds and are more likely to admit students who haven't taken advanced courses in high school, which can be a barrier for students of color. HBCUs are seen as laboratories of success for educating all students, as they prioritize inclusion and offer opportunities to marginalized groups.",1,0,0.130733257661748,0,1,1,0
b97659e0-17c8-4e38-947a-3b35a154af34,Family of academic detained in Egypt accuse US of breaking pledge to help | Egypt | The Guardian,"Salah Soltan, a US green card holder and critic of Egyptian President Abdel-Fatah al-Sisi, has sent a letter from prison to his family, claiming that he faces death in detention. Soltan accuses the Biden administration of abandoning him and breaking their pledge to help with human rights issues. He collapsed in his cell earlier this year and was denied medical treatment for days, despite his history of heart problems. Human Rights Watch has also criticized Egyptian prison authorities for not providing proper medical care. Soltan's family believes that the Biden administration is not prioritizing the safety and freedoms of its own citizens when dealing with Egypt. Soltan, a religious scholar and former minister under President Mohammed Morsi, has been in solitary confinement in the Badr prison complex since his arrest in 2013. Egyptian authorities have been accused of routinely denying prisoners medical care. In his letter, Soltan also renounced some of his former beliefs that he now considers antisemitic. His family hopes that this change of views will help advocate for his freedom.",1,0,0.13813525217284855,0,1,0,0
d71a80aa-b451-4f11-bf38-1d76e487985d,Nato official suggests Ukraine could give up territory in exchange for membership | Ukraine | The Guardian,"A senior NATO official has suggested that Ukraine could give up territory to Russia in exchange for NATO membership and an end to the war. Stian Jenssen, chief of staff to NATO secretary general Jens Stoltenberg, made the suggestion at an event in Norway. However, Ukraine has consistently called for a restoration of its pre-2014 borders and is currently engaged in a counteroffensive to recapture its seized territory. The proposition was met with anger from Kyiv, who stated that any land-for-NATO deal would reward Russian aggression. Mykhailo Podolyak, a senior adviser to Ukraine's president, criticized the idea, saying it would mean choosing the defeat of democracy and encouraging a global criminal. He also warned that unless Russia suffered a heavy loss in the war, it would continue to pose a long-term problem for the West. Ukraine's position is being tested by the slow progress of its counteroffensive, despite receiving donations of western tanks and weapons.",1,0,0.6248910646645022,0,1,0,0
1e58d8ba-746b-423a-83ab-c476deaef7a8,What to know about the 30 unindicted co-conspirators in Georgia election investigation | Georgia | The Guardian,"Georgia district attorney Fani Willis has unsealed a 41-count indictment against Donald Trump and 18 others for their involvement in a plot to subvert the 2020 presidential election. All defendants, including Trump, have been charged with racketeering under Georgia's Rico Act, which carries a sentence of five to 20 years. The indictment also lists 30 unindicted co-conspirators who participated in the criminal enterprise. While Willis did not charge these individuals, it does not mean they cannot face penalties in the future for their involvement in the election fraud plot. Among the 30 unnamed co-conspirators are 13 Georgia Republican electors, including three fake electors who were named as defendants in the indictment. These fake electors cast fraudulent votes for Trump and committed offenses such as impersonating a public officer, forgery, and filing false documents. The other 13 unnamed co-conspirators are listed as Individual 2 to Individual 19.",1,0,0.3954879324215608,0,1,0,0
a72f3f69-798a-47c6-8929-ed8d2c97c9bf,What is Rico? Georgia uses racketeering law to charge Donald Trump | Georgia | The Guardian,"Fulton County District Attorney Fani Willis has used Georgia's version of the Racketeer Influenced and Corrupt Organizations Act (RICO) to charge Donald Trump and 18 others with alleged efforts to overturn the 2020 presidential election results. The 96-page, 41-count indictment accuses Trump and his allies of conspiring to reverse the election outcome. The Georgia statute allows prosecutors to include alleged unlawful activity that occurred outside of Atlanta, such as a meeting in Michigan to overturn election results there. It also enables them to connect seemingly small or irrelevant occurrences to demonstrate a pattern of behavior. The indictment alleges that the defendants violated election laws by spreading false statements about voter fraud and strategizing to disrupt the counting of electoral votes in Congress. The use of Georgia's broader RICO law allows prosecutors to tie together events that may appear distinct. The charges aim to show that the unlawful enterprise was established to overthrow the election and deny Georgians their right to vote.",0,0,0.0,1,1,0,0
d5889812-e35f-4ff6-8361-b841e1b1f342,"Trump Rico case ‘a nuclear bomb where a bullet’ would do, Republican says | Donald Trump | The Guardian","Congressman Ken Buck, a Republican member of the House judiciary committee, criticized the indictment of Donald Trump and 18 allies for election subversion in Georgia, stating that it was like using a nuclear bomb when a bullet would have been appropriate. Buck explained that the indictment could have been a Rico indictment, referring to racketeering law, which is typically used for mafia cases and international drug organizations. He believed that the scope of the charge should have been handled at the federal level, if at all. The indictment, obtained by the district attorney of Fulton county, Fani Willis, includes 13 counts against Trump for his attempt to reverse his defeat by Joe Biden in Georgia in 2020. Despite facing numerous criminal charges and legal cases, Trump continues to dominate Republican polling and is expected to face Biden again in the next presidential race. Buck, who is known for being more independent, expressed concerns about the charges brought against Trump.",1,0,,0,1,0,0
e6a1254d-cc42-4151-a9c0-f49d84ebaf85,"Chinese social media filled with anti-black racist content, says watchdog | China | The Guardian","Chinese social media platforms, such as Bilibili, Douyin, Kuaishou, Weibo, and Xiaohongshu, are filled with racist content targeting black people, according to a report by Human Rights Watch (HRW). The watchdog analyzed hundreds of videos posted on Chinese social media since 2021 and found that major platforms do not address racist content. The videos often depict people in African countries as primitive or impoverished, with Chinese content creators portrayed as wealthy saviors. Some videos also denigrate interracial relationships between black men and Chinese women. Chinese women who post photos with their black partners sometimes face online harassment, including death threats and doxing. Chinese authorities have condemned online racism and promised to crack down on unlawful online acts. However, there have been cases where Chinese people who support victims of anti-black racism in China were labeled as traitors online. The report comes after a Chinese vlogger, Lu Ke, was convicted in Malawi for child trafficking and using children for entertainment purposes. He had created videos featuring Malawian children, which were sold on Chinese social media platforms.",1,0,0.23844164518719924,0,1,0,0
36a36f9b-27d7-4b3d-8ccf-a58e5e20eb3a,Mob attacks churches in eastern Pakistan after blasphemy claim | Pakistan | The Guardian,"A Muslim mob in eastern Pakistan attacked a Christian community after accusing its members of desecrating a copy of the Quran. The mob vandalized several churches and set scores of houses on fire in Faisalabad. The attack was triggered by religious zealots who accused a local Christian family of blasphemy, sharing photos and videos of burnt pages of the Quran. Four churches were set on fire, but there were no reports of injuries. The Christian community in Pakistan, which makes up about 2% of the population, is frequently targeted with spurious blasphemy allegations. Blasphemy is a sensitive issue in the country, where insulting Islam or Islamic figures can result in the death penalty. Islamist right-wing leaders and political parties often rally around the issue, leading to violence and unrest. The Christian community is calling for justice and action to protect their lives and assure them that they are valued in their own homeland.",1,0,0.13316518295883883,0,1,0,0
0a54e588-fab4-4722-9b8b-56cdb273fed5,Alpine hikers warned of €750 fine for excessive flower picking | France | The Guardian,"French police have issued a warning to hikers in the Alps, stating that they will be fined up to 750 euros for excessive flower picking. This comes after officers confiscated thousands of génépi sprigs and edelweiss flowers during a recent enforcement operation. While not all mountain plants and flowers are officially protected, conservationists argue that the destruction of local flora is endangering the biodiversity of the Savoie and the wider French Alps. In the Savoie region, there is a ban on picking blooms of protected plants, including certain species of lilies, cyclamen, and arnica. Picking the flowers of the edelweiss, made famous by the song in The Sound of Music, is also prohibited. However, visitors are allowed to collect génépi, an aromatic plant used to produce liqueur, but only 120 sprigs per day. In the Vosges region, the commercial harvesting of arnica plants has been banned for the second year in a row due to drought. The Vosges mountains typically provide three-quarters of France's wild harvest of arnica.",1,0,0.06355589497770359,0,1,0,0
