article_id,article_title,article_summary,skip_forwards,skip_backwards,average_skip_perc,listens,unique_users,saves,archives
dd658fb3-008f-4dc8-9df1-b1bb9f38bfb5,Quebec judge gives go-ahead for lawsuit over sterilisation of Indigenous women | Quebec | The Guardian,"A judge in Quebec has approved a class action lawsuit against three doctors, a community health agency, and a hospital over the forced sterilization of Indigenous women in the province. The lawsuit was brought by two Atikamekw women who accuse the doctors of performing or coercing sterilization procedures without consent in a remote town in northern Quebec. The women also allege systemic prejudice against Atikamekw patients by the health organizations involved. The judge ruled that all Atikamekw women who were forcibly sterilized at that location since 1980 could be included in the lawsuit, along with their partners, caregivers, children, grandchildren, and other rightful heirs. The plaintiffs claim that they were not informed or gave free consent for the sterilization procedures. Forced sterilization of Indigenous women is seen as a form of violence connected to the broader context of colonialism in Canada. Experts have identified hundreds of cases of forced or coerced sterilization, including recent instances.",1,0,0.6374216398377175,0,1,0,0
369700e3-7091-4c95-9f11-de51ec0754a2,Marjorie Taylor Greene: ‘My name is on a list’ of Trump vice-president picks | Republicans | The Guardian,"Marjorie Taylor Greene, a far-right congresswoman from Georgia, has revealed that her name is on a list of potential vice-president picks for Donald Trump if he wins the Republican nomination in the next election. Greene, known for her controversial and conspiracy theory-laden statements, stated that she would consider the role but is currently focused on serving her district. She has been involved in numerous controversies, including promoting anti-Semitic conspiracy theories and doubting school shootings. Greene also expressed support for Trump's decision to skip the Republican debate, stating that it would be a waste of his time. She believes that Trump's running mate will not be among the candidates on the debate stage. There has been speculation about whether some of the candidates on the stage are vying for the position.",0,0,0.0,1,1,0,0
70605827-c2a9-42ca-8e27-01b837195a48,US seeks to extend longstanding scientific research agreement with China | US foreign policy | The Guardian,"The US state department has announced that it is seeking a six-month extension to a longstanding science and technology agreement with China. The agreement, which has been renewed approximately every five years since 1979, has facilitated cooperation between the two countries in various scientific and technical fields. However, concerns about China's military capabilities and alleged theft of US scientific and commercial achievements have raised questions about whether the agreement should continue. The state department spokesperson emphasized that the extension does not commit the US to a longer-term agreement, but rather allows for negotiations to amend and strengthen the terms of the agreement. If the agreement were to lapse, individual agencies would have to negotiate separate arrangements with China. Republican lawmakers have called for the agreement to be scrapped, citing concerns about industrial espionage and forced technology transfers that could contribute to China's military modernization. Chinese officials have expressed a desire to extend the deal.",0,0,0.0,1,1,0,0
81b64d41-7e6d-4b31-9795-8e5ca0a59e52,Republican debate live: Trump a no-show as eight presidential hopefuls will compete for spotlight | Republicans | The Guardian,"The first Republican primary debate is set to take place without frontrunner Donald Trump, who will be interviewed by Tucker Carlson instead. The debate will feature all of the party's main presidential contenders, including Ron DeSantis, Chris Christie, Tim Scott, Vivek Ramaswamy, Nikki Haley, Mike Pence, and Asa Hutchinson. However, Doug Burgum may not attend due to a leg injury. Meanwhile, Rudy Giuliani surrendered after posting bail in Georgia, where he and other co-defendants are facing an indictment over their attempt to disrupt the 2020 election. The debate will be aired on Fox News at 9pm Eastern time.",0,0,0.0,1,1,0,0
3994c02b-8941-4660-8e6f-495e117de24f,North Korea fails in second attempt to launch spy satellite as rocket crashes into sea | North Korea | The Guardian,"North Korea's second attempt to launch a spy satellite has failed as the rocket crashed into the sea. The rocket experienced a problem during its third stage, according to state media. This follows a previous failed attempt in May. North Korea plans to try again in October. The country aims to place its first military spy satellite into orbit to monitor moves by US and South Korean troops. The first and second stages of the rocket were normal, but the launch failed due to an error in the emergency blasting system during the third stage. South Korea's military also confirmed the launch as a failure and condemned it as a provocation and violation of UN security council resolutions. The US expressed concern over reports of Russia-North Korea nuclear cooperation.",0,0,0.0,1,1,0,0
37ff4ee0-4ffc-49d1-b4f0-6b3b1540aaab,Trump’s absence keenly felt at first Republican presidential primary debate | US elections 2020 | The Guardian,"Eight Republican presidential candidates gathered in Milwaukee, Wisconsin for the first debate of the primary season. However, the absence of frontrunner Donald Trump cast a shadow over the event. Trump confirmed he would skip the debate, narrowing the field to eight participants. The debate began with candidates attacking Joe Biden's economic record and blaming him for high inflation rates. Nikki Haley criticized fellow Republicans, including Trump, for contributing to record-high federal debt. Several other primary candidates failed to meet the Republican National Committee's qualifications for the debate. The qualifying candidates faced the challenge of trying to reduce Trump's significant polling advantage. A CBS News/YouGov survey showed Trump with his largest polling lead to date, winning the support of 62% of likely Republican primary voters. Trump cited this poll as a reason for skipping the debate.",0,0,0.0,1,1,0,0
7bd807f5-4a8e-4334-ae4f-30b72da0913d,Cotton Capital: Reparations – episode 6 – podcast | News | The Guardian,"The Guardian's podcast ""Cotton Capital: Reparations"" is on its sixth episode. The podcast explores the history of slavery in the United States and the ongoing debate about reparations. The episode focuses on the city of Natchez, Mississippi, which was once the center of the cotton industry and had the highest concentration of millionaires in the country. The podcast highlights the wealth accumulated by white plantation owners through the labor of enslaved people and the lasting impact of slavery on the Black community. It also discusses efforts by activists and scholars to advocate for reparations and address the economic disparities that persist today. The episode features interviews with local residents and historians, providing insights into the complex legacy of slavery in Natchez and the broader conversation about reparations in the United States.",1,0,0.08671628483703353,0,1,0,0
9e5fcbf6-353b-4167-9afb-24c6a889d469,Biden points finger at Putin as Prigozhin’s reported death seen as a warning to ‘elites’ | Yevgeny Prigozhin | The Guardian,"Joe Biden has implied that Vladimir Putin may be involved in the reported death of Yevgeny Prigozhin, the founder of Wagner, who died in a plane crash. Ukrainian officials see the incident as a warning to Russian elites, and flowers were laid outside Wagner's headquarters in St. Petersburg. The cause of the crash is unknown, but Prigozhin's feud with the military and his armed uprising in June may have provided a motive for revenge. Ukrainian presidential aide Mykhaylo Podolyak believes the crash is a signal from Putin to Russia's elites ahead of the 2024 elections. Russian journalist Ksenia Sobchak also sees it as a clear signal to all the elites. The Kremlin has not yet commented on the crash, and Putin did not mention it during a speech in Moscow. Prigozhin and senior Wagner commander Dmitry Utkin were among the 10 people on the plane. Biden stated that he is not surprised by the incident, as he believes Putin is involved in much of what happens in Russia.",0,0,0.0,1,1,0,0
0d8041cb-45d2-4299-bd25-e52af3dc5a10,At a glance: Wagner boss Yevgeny Prigozhin ‘dead in plane crash’ – what we know so far | Russia | The Guardian,"Yevgeny Prigozhin, the boss of Wagner, a Russian private military company, has died in a plane crash along with nine others. The plane was en route from Moscow to St. Petersburg when it crashed near the village of Kuzhenkino in the Tver region. The cause of the crash is not yet known, but Prigozhin's allies have accused the Russian defense ministry of assassinating him. Russian investigators have opened a criminal investigation into the incident. Unverified videos on social media show a plane resembling a private jet falling from the sky and burning wreckage on the ground. The other passengers on board have been named as Sergey Propustin, Evgeniy Makaryan, Aleksandr Totmin, Valeriy Chekalov, and Nikolay Matuseev. The crew members were Commander Aleksei Levshin, co-pilot Rustam Karimov, and flight attendant Kristina Raspopova. Prigozhin had been accompanied by a cameraman, Wagners logistics manager, and his personal security detail. There has been no official comment from the Kremlin or the defense ministry.",1,0,0.20637861449489353,0,1,0,0
70cf2688-7929-4247-917b-ac25eb9479b1,‘They’re savage animals’: Trump attacks the left in Tucker Carlson interview | Donald Trump | The Guardian,"In a Twitter interview with Tucker Carlson, former President Donald Trump warned of a potential conflict in the US and expressed concerns that the Democrats will steal the 2024 election from him. Trump also suggested that he is worried about the left trying to kill him. The interview touched on various conspiracy theories, including whether Jeffrey Epstein was murdered and the role of federal agencies in limiting water in washing machines. Trump criticized his critics in his usual derisive manner. When asked if he thinks the US is headed towards civil war, Trump acknowledged the level of passion and hatred in the country, calling it a bad combination. He further referred to the left as ""savage animals"" and ""sick"" individuals. The interview, which was broadcast on Twitter, gained over 80 million views within two hours of being posted, potentially upstaging Trump's rivals in the 2024 election.",0,0,0.0,1,1,0,0
980fef15-02b2-46ab-8d54-8c9efebc8675,Combative Vivek Ramaswamy emerges as surprise focal point of GOP debate | Republicans | The Guardian,"Vivek Ramaswamy, a biotech entrepreneur, unexpectedly became the focal point of the GOP debate in the absence of Donald Trump. He showed little respect for other candidates and faced heavy criticism in return. Ramaswamy has been running third in Republican polling and has been hit by scandals over remarks suggesting sympathy for conspiracy theories. However, he has positioned himself as a Trump-like outsider challenging the establishment. During the debate, Ramaswamy criticized the other candidates for being influenced by donors and dismissed the climate crisis as a hoax. He also attacked former vice-president Mike Pence and questioned Ronald Reagan's legacy. Despite the presence of other candidates, Ramaswamy's confrontational style made him a prominent figure in the debate.",0,0,0.0,1,1,0,0
04ae0d20-822b-4d2f-a1f9-e876fa250967,"Facebook groups exposed to hundreds of hoax posts, study shows | Facebook | The Guardian","A study by fact-checking charity Full Fact has found that Facebook groups are being exposed to hundreds of hoax posts. These false posts include reports of missing children and deadly snakes on the loose, and are designed to terrify local communities. Full Fact discovered over 1,200 false posts on community groups across the world, and warned that this is likely just the tip of the iceberg. The charity expressed concern that these hoaxes could lead to people becoming overwhelmed with false information and ignoring genuine posts about dangers. It is unclear why this content is being spread, but Full Fact suggested it could be for monetary gain or to promote products or services. The investigation found that the misinformation was present in over 100 areas in the UK, with claims ranging from serial killers on the loose to men armed with knives attacking people. Full Fact raised the alarm about these hoaxes with Facebook owner Meta, but did not receive a response.",1,0,0.758707561728395,0,1,0,0
c3b103ee-0ad9-4522-8e59-fb18a5492bdf,Republican presidential candidates clash at first 2024 debate – in pictures | US news | The Guardian,The first 2024 Republican presidential debate was marked by clashes between the candidates. The Guardian provides a picture gallery of the event. The article does not provide any further details or analysis.,0,0,0.0,1,1,0,0
a087a374-1f2e-40c9-a883-70c53f8bdcc2,Brain implants could restore communication for people with paralysis - The Verge,"Two separate studies published in Nature suggest that brain-to-computer interfaces (BCI) could restore communication for people with severe paralysis. Researchers implanted electrodes into the brains of patients and used algorithms to translate brain signals into sentences on a screen. The Stanford study focused on a patient with ALS, while the UC San Francisco and UC Berkeley study involved a person with paralysis from a brainstem stroke. Both studies achieved similar results in terms of accuracy and speed, with the Stanford algorithm converting brain signals to words at 68 words per minute and the UC San Francisco and Berkeley algorithm decoding at a median rate of 78 words per minute. While the error rates are not yet suitable for everyday use, they represent significant improvements over existing technology. The studies are considered proof of concept, and more research is needed before the technology is ready for widespread use.",0,0,0.0,1,1,0,0
61ce4461-0734-49e3-9387-b81c99fb67ac,Brain implants could restore communication for people with paralysis - The Verge,"Two separate studies published in Nature show that brain-to-computer interfaces (BCI) could restore communication for people with severe paralysis. In one study, researchers implanted electrodes into the brain of a patient with ALS and used an algorithm to associate brain activity patterns with speech sounds. The algorithm was trained by having the patient attempt to vocalize or silently mouth sample sentences. The other study involved surgically placing electrodes on the brain of a person with paralysis from a brainstem stroke. The algorithm was trained by having the patient attempt to speak, and the signals were translated into facial expressions and modulated speech on a digital avatar. Both studies showed promising results, with the Stanford algorithm converting brain signals to words at 68 words per minute and the UC San Francisco and Berkeley algorithm decoding at a median rate of 78 words per minute. Although there is still room for improvement, these studies represent a significant advancement in the field of brain implants for communication restoration.",1,0,0.12684956395348837,0,1,0,0
5cbb7018-ae9d-4204-8ea1-9b1327878ad4,"Today on The Vergecast: Computers made of wood, and apps made of other apps. - The Verge","In a recent episode of The Vergecast, the hosts discuss the possibility of creating a high-quality computer out of wood. They question whether this would be desirable and explore the potential limitations of using wood as a material for a PC. Additionally, the hosts ponder the idea of a ""super app"" and whether Elon Musk, Mark Zuckerberg, or anyone else could create such a revolutionary application. The episode delves into the contrasting visions of computing and explores the possibilities and limitations of these ideas. The Vergecast is a podcast that covers various topics related to technology, apps, and the tech industry. The Verge is a Vox Media network that provides news and reviews on technology, science, entertainment, and more.",2,1,1.3713664067739773,0,1,0,0
da4328c4-d903-4c89-bbc3-0214ded351b6,Reddit comments might not load for you right now - The Verge,"Reddit is experiencing issues with loading comments, with some users seeing blank comments or receiving error messages. The problems seem to be affecting both old and new versions of Reddit. The site's status page claims that all systems are operational, but Reddit has not yet responded to requests for comment. Downdetector has recorded around 1,800 user reports of issues, which is relatively low for such a large platform. This follows previous outages that occurred earlier this month. The Verge reached out to Reddit for further information but has not received a response.",1,0,0.06119537218947827,0,1,0,0
109135a8-a595-486b-9197-0c3c924007de,Reddit comments might not load for you right now - The Verge,"Reddit is experiencing technical issues, with comments not loading properly for some users. The site is still showing posts, but comments are missing, and there are server error notifications. The issues seem to be affecting both old and new versions of Reddit, with some users encountering a 504 Gateway Timeout message. Reddit's status page claims that all systems are operational, but the company has not responded to requests for comment. There have been previous outages lasting about an hour earlier this month. Despite the issues, user reports of problems on Downdetector are not particularly high.",1,0,0.018985754539762055,0,1,0,0
eb0efbc3-5ace-4170-ac1c-2f7e03f8a0a2,"We’ve got gems like an Amiga 2000, Apple II, Tandy TRS-80, and how about an early laptop docking station? - The Verge","The Verge is excited about the vintage computer setups they have received from their listeners, including an Amiga 2000, Apple II, Tandy TRS-80, and an early laptop docking station. They encourage their audience to share their own vintage battlestations by emailing them. One of the submissions they received was a living room setup with an Amiga 2000, which they found impressive. The Verge is a part of the Vox Media network and provides tech, reviews, science, and entertainment content. They have a privacy policy, cookie policy, and do not sell or share personal information. They also have guidelines for their community and an ethics statement.",1,0,0.49756890514184404,0,1,0,0
5e9daac8-3730-4a2b-b51b-10f6de8b7aaa,"SPACs, explained - The Verge","SPACs, or special-purpose acquisition companies, are a type of merger vehicle that have gained popularity in recent years. They are essentially a pool of cash that exists for the purpose of acquiring another company. SPACs are also referred to as blank-check companies. The reason why SPACs have been in the news more frequently is because there have been a record number of SPAC initial public offerings (IPOs) in 2020. SPACs have been around since 2003, but they have become more popular recently as an alternative to traditional IPOs. Traditional IPOs can be complex and time-consuming, whereas SPACs offer a faster and simpler process. With a SPAC, the IPO is already completed, so companies don't have to go through the roadshow process or negotiate with multiple investors. However, there are some downsides to going public through a SPAC, such as potentially attracting short-term investors and facing less scrutiny of the existing business. Additionally, SPACs can be more expensive than IPOs.",0,0,0.0,1,1,1,0
3aa092fe-f413-4cda-b27b-0a8d9a4db88e,"“In any just world, Chamath Palihapitiya would be ashamed of himself. “ - The Verge","The Verge criticizes Chamath Palihapitiya, calling for him to be ashamed of himself in a just world. The article reviews Palihapitiya's involvement in the SPAC (special purpose acquisition company) craze, questioning his lack of due diligence and the impact on his reputation. The author suggests that Palihapitiya traded his reputation for SPAC sponsor fees without fully considering the consequences. The article refers readers to an explainer on SPACs and concludes by stating that Palihapitiya should have considered how his reputation would be affected before getting involved in the arena.",0,0,0.0,1,1,0,0
8197f597-6c03-4fbe-91bb-f3dd667bf1f9,Reddit shared the schedule for its mod roadshows. - The Verge,"Reddit has announced the schedule for its mod roadshows, which will take place throughout the rest of the year. The company has had a strained relationship with some moderators due to recent protests, so these events may help improve the situation. In addition to the roadshows, there will also be a virtual Global Mod Summit on December 2nd. Reddit initially announced a tentative schedule for the roadshows in July and invited people to participate in an accessibility feedback group. However, moderators of r/Blind have declined to join the group. Overall, Reddit is making efforts to engage with its moderators and address their concerns.",0,0,0.0,1,1,0,0
5cb8c86c-dc68-45fc-bbd8-e48a619d54e3,How Reddit crushed the biggest protest in its history - The Verge,"Reddit recently faced a major protest from its community after platform changes threatened to shut down popular third-party apps and services. Communities like r/homeimprovement locked down in protest, hoping to show the strength of Reddit's community and push for a solution. However, after more than two weeks, most communities have reopened, and Reddit doesn't appear to be backing down. This conflict highlights the importance of Reddit's community and the limits of its power. The platform's decision to charge for API access, which developers use to tap into Reddit's data, has also caused controversy. While some developers initially saw potential benefits, the revealed pricing was deemed unreasonable, with one developer estimating a cost of $20 million per year. Charging for API access could help address Reddit's lack of profitability, but it also risks alienating users and damaging the platform's reputation. This situation comes as Reddit prepares for its IPO, making its handling of the protest and API changes a risky move.",0,0,0.0,1,1,0,0
11fc74bd-de85-4489-965f-e4779bc080d7,Nvidia Q2 2024: $6 billion in pure profit over the AI boom - The Verge,"Nvidia has reported $6 billion in pure profit for Q2 2024, driven by the AI boom. The company generated $13.5 billion in revenue during this period, with demand for its generative AI chips surpassing difficulties in selling desktop and laptop GPUs. Data center revenue accounted for a record $10.32 billion, while gaming revenue reached $2.48 billion, up 22% year over year. Nvidia's Q2 2024 earnings mark a significant milestone for the company, which joined Apple, Amazon, Google, and Microsoft as trillion-dollar companies. The company is forecasting $16 billion in revenue for the next quarter. Its chief rivals, Intel and AMD, do not yet have convincing answers to Nvidia's AI chips, although AMD's MI300 may arrive in the fourth quarter. Both companies are attempting to downplay the importance of AI chips in servers, promising to incorporate AI features into their client chips as well.",0,0,0.0,1,1,0,0
f5057a73-8eaa-4e52-8451-64c6a4f011c3,Nvidia Q2 2024: $6 billion in pure profit over the AI boom - The Verge,"Nvidia has reported $6 billion in pure profit in Q2 2024, driven by the demand for its generative AI chips. The company's revenue reached $13.5 billion, with data centers contributing a record $10.32 billion. Nvidia's profit increased by 843% year over year. Gaming revenue also saw a 22% year-over-year growth to $2.48 billion. Nvidia's success in the AI boom has propelled it to join Apple, Amazon, Google, and Microsoft among the world's trillion-dollar companies. The company is forecasting a revenue of $16 billion for the next quarter. Nvidia's chief rivals, Intel and AMD, are yet to provide convincing alternatives to Nvidia's AI chips. Both Intel and AMD have downplayed the importance of AI chips in servers, promising to incorporate AI features in their client chips. However, AMD CEO Lisa Su believes that AI will be the largest growth driver for the company in the next five years.",1,0,0.07888642162098018,0,1,1,0
3f6cd1fc-ea64-4a38-828a-ea8eaf52912f,GuliKit’s Steam Deck dock looks like a Super Nintendo - The Verge,"GuliKits, a company known for its aftermarket gamepads and replacements for Nintendo Switch and Steam Deck, has released a new docking station that resembles a Super Nintendo. The docking station has a sliding shell that reveals a space for a PC gaming handheld or a Nintendo Switch. However, it is unclear how the USB-C port on the bottom of the Switch would be accessed. The docking station also lacks USB ports on the front where the controllers would plug in. Additionally, GuliKits has released a new gamepad called the KK3 Max, which resembles the Xbox Elite controller and includes features such as rear paddles, bean-shaped buttons similar to Sony's DualSense Edge, and triggers that can switch between digital and analog modes. The gamepad also features RGB lighting and a patented magnetic motor for haptics. GuliKits has not released pricing or release dates for these products.",1,0,0.05678320284181528,0,1,0,0
