article_id,article_title,article_summary,skip_forwards,skip_backwards,average_skip_perc,listens,unique_users,saves,archives
b701c72c-bd5a-4369-8020-4b02b460c951,Page Not Found,"The text is a collection of links and categories from the Wall Street Journal website. It includes various topics such as world news, business, finance, technology, opinion, arts and culture, lifestyle, health, science, and sports. Each category has subtopics and additional links for readers to explore. The website also offers podcasts and videos on different subjects. Overall, the text serves as a guide to the different sections and content available on the Wall Street Journal website.",1,0,0.17791365530257466,0,1,0,0
066fc59f-8cb2-4b95-a646-a0dcbca940d3,Spotify Annoyed by People Uploading Hours of White Noise,"Spotify has become annoyed with the trend of people uploading hours of white noise to the platform. These episodes of white noise, often aimed at listeners who are asleep, have become popular and some podcasters are making up to $18,000 a month through ads placed in these episodes. However, Spotify sees this trend as a loss of profit and is looking for ways to direct listeners towards more profitable content. White noise and ambient podcasts are currently accounting for 3 million daily consumption hours on the platform. Spotify believes that by shifting users away from white noise programming, it could potentially gain an additional $38 million in profit. Some white noise podcasts have mysteriously disappeared from the platform, leading to speculation about Spotify's involvement. In addition to white noise, Spotify has also been dealing with AI-generated music and concerns about the value of reputable artists' tracks compared to noise uploads.",0,0,0.0,1,1,0,0
89dbc13b-dc75-4259-9340-f0176170543a,GitHub - Part-DB/Part-DB-server: Part-DB is an Open source inventory management system for your electronic components,"Part-DB is an open-source inventory management system for electronic components. It offers features such as automating workflows, hosting and managing packages, finding and fixing vulnerabilities, creating instant dev environments, writing better code with AI, managing code changes, planning and tracking work, and collaborating outside of code. Part-DB is available for enterprise teams, startups, and education purposes. The project has 282 stars and 44 forks on GitHub. It is licensed under the AGPL-3.0 license. The repository includes code, issues, pull requests, discussions, actions, projects, wiki, and security insights. The commit mentioned does not belong to any branch on the repository and may belong to a fork outside of the repository. There is a warning about creating a branch with a name that already exists as a tag, as it may cause unexpected behavior.",0,0,0.0,1,1,0,0
14d0c9fd-eaa3-4260-a4f3-bdaf4d86a822,Why you should check your secrets into Git | Warren Parad - YouTube,"In a YouTube video titled ""Why you should check your secrets into Git,"" Warren Parad discusses the importance of storing secrets in Git repositories. He explains that secrets, such as API keys and passwords, are valuable assets that need to be protected. By checking them into Git, developers can ensure that these secrets are version controlled and easily accessible to the team. Parad emphasizes that this practice allows for better collaboration and transparency within the development process. He also highlights the benefits of using tools like Git Secrets and Git Crypt to encrypt and secure sensitive information. Parad concludes by urging developers to prioritize the security of their secrets and consider integrating them into their Git workflows.",1,0,0.27332632076425684,0,1,0,0
df11c499-1789-46f9-9ce3-1af0aa853b33,Websites and apps millionaires and billionaires use,"The ultra-wealthy use exclusive apps and websites instead of popular ones like Amazon, Instagram, and Tinder. James Edition is a shopping site where the rich can buy extravagant items like private jets and yachts. The site also offers travel bookings for luxury experiences. Rich Kids is an exclusive photo sharing network where users pay $1,000 a month to only see photos from other wealthy individuals. Luxy is an elite dating app for the ultra-wealthy, claiming that half of its members earn over $500,000 a year and 41% earn at least $1 million annually. However, Luxy has faced criticism for its exclusivity, as it has kicked out 40,000 members for being ""too poor, too ugly or both."" These exclusive platforms cater to the needs and desires of the super wealthy, allowing them to showcase their wealth and connect with others in their social circle.",0,0,0.0,1,1,0,0
61d49292-ffd2-403e-bd40-6fc4bf2b6bf6,"Amsterdam to use ""noise cameras"" against too loud cars | NL Times","Amsterdam is taking action against noisy cars by using ""noise cameras."" The city has installed electric road signs in two locations to warn drivers if their vehicles are too loud. These signs will eventually be replaced by noise cameras, which will automatically send fines to offending drivers. The initial test with the noise signs will take place in the city center and Amsterdam-Noord. If the noise meter detects excessive noise, the driver will see a message indicating that their vehicle is too loud. More sound meters and signs will be installed in other areas later this month. The municipality hopes that the signs alone will raise awareness among drivers about the noise their vehicles produce. Rotterdam is also conducting a similar experiment in collaboration with Amsterdam. The noise cameras consist of a box with four microphones that can pinpoint the source of the sound. If the current experiment is successful, Amsterdam and other cities will seek certification for the technology.",1,0,0.7467444221991485,0,1,0,0
1bc884c5-a84c-4168-873a-d7b4133f5e18,Why Do Old Books Smell So Good? – ScienceSwitch,"Old books have a distinct smell due to the release of volatile organic compounds (VOCs) as they decay over time. The specific VOCs depend on the paper, inks, and binding materials used, giving each book its unique scent. New books, on the other hand, have a crisper and fresher smell because they use different chemicals during manufacturing that produce different VOCs as they break down. Scientists can analyze the VOCs from an old book to determine its age, condition, and even its manufacturing origins. They can also identify degradation and preservation needs. Librarians and historians use VOC analysis to study collections and match orphaned books with their original libraries based on chemical fingerprints. The VOCs can also provide clues about a book's exposure to elements like smoke or water. Understanding the scent of old books allows us to delve into the history and origins of these ancient texts.",1,0,0.14792582377006666,0,1,0,0
f43eb12b-d64a-4969-83cb-af3b7b527702,Windy: Wind map & weather forecast,Windy.com is a website that provides a wind map and weather forecast. It uses data from OpenStreetMap contributors.,0,0,0.0,1,1,0,0
9f8c6fd6-23bf-4df7-98ec-4ac020f9f6c5,Fart Proudly - Wikipedia,"""Fart Proudly"" is an essay written by Benjamin Franklin in 1781 while he was serving as the United States Ambassador to France. Franklin wrote the essay in response to a call for scientific papers from the Royal Academy of Brussels. In the essay, Franklin humorously suggests that research be conducted into improving the odor of human flatulence. He discusses how different foods affect the smell of flatulence and proposes scientific testing of farting. Franklin even suggests the development of a drug that can be mixed with food to make flatulence smell pleasant. Copies of the essay were privately printed by Franklin and distributed to friends, including the famous chemist Joseph Priestley. The essay was long excluded from published collections of Franklin's work but has since gained recognition as an example of his wit and humor.",0,0,0.0,1,1,0,0
435bc417-a30c-4885-ad8c-5ddaeb9e5ea6,"Fully Intact Giant Panda Skeleton Discovered in Chinese Emperor's 2,000-Year-Old Tomb | Smart News|
 Smithsonian Magazine","Archaeologists have discovered the fully intact skeleton of a giant panda in the 2,000-year-old tomb of Chinese Emperor Wen. The tomb, located in China's Shaanxi Province, contained a variety of rare animal species, including golden snub-nosed monkeys and red-crowned cranes. This is the first time a complete panda skeleton has been found at an ancient Chinese burial site. The remains were identified as belonging to a Qinling panda, a subspecies with rounder faces. The panda was buried in a sacrificial pit outside the emperor's grave, with its head facing the tomb and its tail facing west. Similar partial remains of sacrificed pandas have been found at other burial sites. The discovery highlights the practice of burying animals with ancient Chinese royals for the afterlife, with rarer species reserved for imperial mausoleums.",1,0,,0,1,0,0
933ee3bd-0472-4ae8-a87b-b554198b4bb9,GitHub - leejet/stable-diffusion.cpp: Stable Diffusion in pure C/C++,"The text is a description of a GitHub repository called ""leejet/stable-diffusion.cpp."" It is a project written in pure C/C++ that implements stable diffusion. The repository has 354 stars and 21 forks. It is licensed under the MIT license. The repository has 6 issues and 1 pull request. There are no projects or security insights associated with the repository. The commit mentioned in the text does not belong to any branch on the repository and may belong to a fork outside of the repository. The text also includes options to switch branches or tags, but it indicates that there is nothing to show for both. There is a warning that a name already exists and creating a branch with that name may cause unexpected behavior. The text also mentions options for cloning the repository and using GitHub CLI.",2,1,1.8149606697959069,0,1,0,0
82b2b23d-86fa-4706-9682-03ff1e4e16b6,Cloud tenancy types to suit everyone | by Tim Bannister | The Scale Factory | Medium,"The article discusses different types of cloud tenancy in software-as-a-service (SaaS) models. The first type is individual platforms, where each customer has their own separate deployment of the system, similar to a silo. The second type is pooled resources, where all tenants share the same infrastructure, which is a common approach in cloud computing. The third type is hybrid tenancies, which combine elements of both individual platforms and pooled resources. 

The article also highlights the importance of choosing the right tenancy model based on the organization's needs and history. For cloud-native products, tenancy decisions need to be made before launching a minimum viable product. For organizations that previously offered on-premises applications, transitioning to the cloud may involve deploying the entire application for each tenant initially, and later migrating to a pooled approach. 

The article emphasizes the need for scalability and stability in cloud infrastructure, especially for SaaS vendors in industries like finance. The demand for the application may vary throughout the year, so having an infrastructure with enough elasticity is crucial. Overall, the article provides insights into the different cloud tenancy types and their suitability for various organizations.",1,0,0.715602336192093,0,1,0,0
cd2af818-c4aa-4c06-a0f7-9ca8baf39e98,Not so solitary predators? Great white shark duo appear to be travelling together | CBC Radio,"Two great white sharks, named Jekyll and Simon, have been observed traveling together in a synchronized manner, challenging the belief that these predators are solitary creatures. The sharks were tagged off the coast of Georgia in December 2022 and have been tracked by marine scientists at Ocearch. They have followed a similar migratory route from Georgia to New England, Maine, and into Canada, where they have spent the summer hunting off the coasts of Quebec, New Brunswick, and Nova Scotia. Although they are not swimming side-by-side, the sharks are consistently within a few kilometers of each other. The scientists suspect that Jekyll and Simon may be genetically related, possibly even brothers, as they are both juvenile males of approximately the same age. Tissue samples have been taken from both sharks for DNA testing. This unusual behavior suggests the existence of a migratory route for white sharks that has not been previously documented.",1,0,0.3294951127698025,0,1,0,0
dcc32e3c-1120-49fb-83e7-a5b968bda3dd,Canada demands Meta lift news ban to allow wildfire info sharing | Reuters,"The Canadian government has demanded that Meta, the parent company of Facebook and Instagram, lift its ban on domestic news to allow people to share information about wildfires in the country. Meta implemented the ban in response to a new law requiring internet giants to pay for news articles. However, individuals fleeing wildfires in the town of Yellowknife have complained that the ban prevented them from sharing important data about the fires. The Canadian government argues that Meta's ban is reckless and is hindering access to vital information during an emergency. Meta has activated the ""Safety Check"" feature on Facebook to allow users to indicate that they are safe in the wake of a natural disaster or crisis. The company claims that users do not come to its platform for news and that being forced to pay for content shared on its platforms is unsustainable for its business.",1,0,0.2580556574549275,0,1,0,0
5403593f-c91d-4873-a144-a6aabb1b5c07,nytimes.com,The New York Times website requires JavaScript to be enabled and ad blockers to be disabled in order to access their content.,1,0,0.019842498989129362,0,1,0,0
3c04872d-4652-4911-9662-6c49f6411718,"AI-Generated Art Lacks Copyright Protection, D.C. Court Says (1)","A federal judge in Washington, D.C. has ruled that artwork created by artificial intelligence (AI) is not eligible for copyright protection because it lacks human authorship. The judge agreed with the U.S. Copyright Office's decision to deny a copyright registration to computer scientist Stephen Thaler, who argued that a two-dimensional artwork created by his AI program should be protected. This ruling is the first to establish a boundary on the legal protections for AI-generated artwork. The judge cited previous cases where copyright protection was denied for works created without human involvement, such as celestial beings and a monkey who took a selfie. The judge acknowledged that the rise of generative AI will raise challenging questions about the level of human input required for copyright protection and how to assess the originality of AI-generated art. Thaler plans to appeal the judgment, and the Copyright Office is reviewing the decision.",0,0,0.0,1,1,0,0
3a8582d6-3386-4c95-849a-1f18ce009480,Bambu Owners Woke Up Yesterday To Find Their 3D Printers Had Gone Rogue - The Messenger,"Bambu Lab, a 3D printer company, experienced a cloud outage that caused their printers to start printing on their own. The outage resulted in a disconnection of one of the MQTT SDK clients, leading to a buildup of print start messages. Although the connection was eventually restored, the printers received the accumulated print start messages and began printing autonomously. Bambu Lab plans to make server-side software improvements to prevent this error in the future. They also intend to implement new software features, such as using a LIDAR scanner to check for objects on the build plate before starting a new print job. Additionally, the company will update their printers to continuously monitor temperature and automatically turn off heater mechanisms if a fault is detected. Bambu Lab will provide assistance, spare parts, and filament to customers who experienced hardware failures due to the incident.",0,0,0.0,1,1,0,0
ca0abe82-69f4-4428-95b1-c08bea4100fa,The Lost Script of Rapa Nui | History Today,"The lost script of Rapa Nui, known as rongorongo, is a mysterious and unusual script used by the Rapa Nui people of Easter Island. There are only 25 surviving examples of rongorongo, all of which are in poor condition and scattered in collections around the world. The script consists of pictographic characters arranged in horizontal lines, with every other line written upside-down. This means that the text had to be turned 180 degrees at the end of each line. The history of rongorongo is elusive, as the first Europeans to visit Easter Island in 1722 did not see any signs of the script. It was not until 1864 that it was noticed, but by then, it was already being forgotten. The knowledge of rongorongo was restricted to a class of priests, but they were taken away by Peruvian slavers in 1862. The mortality rate from tuberculosis in 1867 was catastrophic, leaving almost no one with knowledge of the script. Rongorongo quickly became a relic of the past, with the remaining tablets being used as firewood or for other practical purposes.",1,0,0.09837098655617475,0,1,0,0
bcf538c0-bb21-4bb1-914c-728e6348cc59,China’s defeated youth,"Young people in China, particularly urban youth aged 16 to 24, are facing high unemployment rates, with over 20% joblessness for months. The situation is exacerbated by the fact that higher education no longer guarantees a stable career, as over 70% of unemployed young people in 2021 were graduates. This has led to a growing sense of hopelessness and disillusionment among young Chinese, who feel that their dreams of finding work, buying a house, and supporting a family are increasingly out of reach. The government's response has been scolding rather than addressing the underlying issues. Young people believe that no matter how hard they work or study, they will not be rewarded with a better quality of life, leading to a sense of involution where additional effort does not yield better outcomes. There is also a mismatch between the skills acquired in education and those required by employers, resulting in overqualified graduates taking low-skilled jobs. Overall, the gloom among young Chinese has profound implications for the future of China's economy and the government's ambitions.",0,0,0.0,1,1,0,0
0fe8c760-ed69-4c1a-9a78-a2697c5d0ceb,The Lab-Leak Illusion,"The COVID-19 pandemic has had a significant impact on mental health globally. A study conducted in the UK found that rates of depression and anxiety have doubled during the pandemic. The study also revealed that young people, women, and those with pre-existing mental health conditions are particularly vulnerable. In addition, the pandemic has worsened existing mental health disparities, with individuals from lower socioeconomic backgrounds experiencing higher levels of distress. The increased levels of stress, isolation, and uncertainty caused by the pandemic have contributed to this rise in mental health issues. The study highlights the urgent need for mental health support and resources to address the long-term consequences of the pandemic on mental well-being. It is crucial to prioritize mental health services and interventions to mitigate the impact of the pandemic on individuals' mental well-being and prevent a potential mental health crisis.",0,0,0.0,1,1,0,0
76c01085-ddb7-407a-8ec1-e9ff02738012,Drug dealer gets 10 years in prison for role in actor Michael K Williams’s death | New York | The Guardian,"A drug dealer in New York City has been sentenced to 10 years in prison for providing actor Michael K Williams with fentanyl-laced heroin, which led to his death. Irvin Cartagena pleaded guilty to conspiring to distribute drugs and was sentenced by US district judge Ronnie Abrams. Williams, best known for his role in the TV series ""The Wire,"" died from an overdose in his Brooklyn apartment in September 2021. Cartagena sold him the heroin on a sidewalk in Brooklyn, which was recorded by a security camera. Cartagena could have faced up to 40 years in prison but received a 10-year sentence. He expressed remorse for his actions, stating that he never intended for anyone to lose their life. Prosecutors revealed that Cartagena and others continued to sell fentanyl-laced heroin even after Williams' death. Cartagena eventually fled to Puerto Rico, where he was arrested in February 2022.",1,0,0.3225610898499548,0,1,0,0
307de685-3620-4bb7-9044-f214b2a6c8b9,This proposed plane could support the Air Force over the Pacific | Popular Science,"The US Air Force has awarded a contract worth up to $230 million for the development and production of a prototype Blended Wing Body airplane. The concept art shows a gray plane with a body that starts from a conventional cockpit and broadens into a large wing, with jets mounted on top at the rear. The design offers greater lift, reduces drag, and expands the lifting surface of the aircraft. While it will not have the same stealth capabilities as a long-range bomber, the hope is that it will offer long-range efficient flight, making it a valuable transport and tanker. The announcement of this new plane was tied to a record-setting endurance flight in 1923, which saw repeated mid-air refueling, allowing a plane to continuously transit from Canada to Mexico without landing. The plane's design is aimed at supporting the Air Force over the Pacific Ocean, where planning for war requires more efficient flight.",0,0,0.0,1,1,0,0
908432de-a5f1-4256-b776-eef9ddf5a403,Page not available - PMC,"The text states that access to PubMed Central (PMC) has been blocked because the user is using an automated process to retrieve content in violation of the PMC Copyright Notice. The reason given is automated retrieval by user agent ""python-requests/2.31.0"". The URL that was blocked is provided. The message includes an ID and timestamp. It is mentioned that the use of PMC is free, but users must comply with the terms of the Copyright Notice on the PMC site. To request unblocking of the IP address, the user must send an email to PMC and include all the information provided in the message. The footer includes links to follow NCBI on social media and connect with the National Library of Medicine. It also mentions web policies, FOIA, HHS Vulnerability Disclosure, help, accessibility, careers, and links to NLM, NIH, and USA.gov.",1,0,0.042364022492219607,0,1,0,0
eb2e1fc3-39bd-4cd5-9da3-4ef3157743ab,How gender inequality is hindering Japan's economic growth,"Japan's economy is facing various challenges, including rising energy prices, defense costs, and the impact of the pandemic. Additionally, the country is dealing with plummeting birth rates and an aging population, which threaten the sustainability of its labor market. A study by the Recruit Works Institute predicts a labor supply shortage of millions of people by 2030 and 2040. Gender inequality is another significant issue, as Japan has one of the lowest levels of gender equality among G7 countries. The country has slipped to its lowest ranking yet in the World Economic Health Forum's Global Gender Report, particularly in terms of women in leadership positions. Prime Minister Fumio Kishida has pledged to increase the percentage of women executives in listed companies from 11.4% to 30% or more by 2030, using leadership quotas imposed on these companies. However, previous attempts to address gender inequality in Japan have largely failed due to deeply embedded gender norms in Japanese society, which are connected to patriarchal hierarchies influenced by Confucianism. These norms reinforce traditional gender roles, with men as breadwinners and women as caregivers.",0,0,0.0,1,1,0,0
07ccfd6e-c1d7-460c-bf06-380993207f7c,Life has several exits - Byte Tank,"The author reflects on the various exits in life, such as leaving a workplace, a youth group, high school, hometown, or a long-term relationship. They also mention the ultimate exit from life, one's funeral. The author suggests that these exits can have a significant impact on the people and world around them, and may even change the trajectory of their own life. They acknowledge that while some exits may be celebrated or marked with fulfilling words and thoughts, others may be the last time one sees certain people. The author also contemplates the idea that one's contributions to the world may be forgotten over time, as even famous contemporary personalities like Steve Jobs and Bill Gates might be mostly forgotten in a few centuries. The author concludes by emphasizing the limited and finite nature of life and encourages making the most out of each period.",1,0,0.5429743812613359,0,1,0,0
48bc5291-be7c-447f-a3ca-cc1a65d6fc65,Lucy Letby: Police urged to investigate hospital bosses for corporate manslaughter | Lucy Letby | The Guardian,"Hospital bosses who failed to act on concerns about nurse Lucy Letby, who was found guilty of murdering seven babies and attempting to kill another six, should be investigated for corporate manslaughter, according to the prosecution's key medical expert. Dr. Dewi Evans, speaking to The Observer, stated that the executives were grossly negligent for not addressing the fears surrounding Letby. The article also reveals that managers at the hospital blamed other NHS services for the unexplained deaths and declared in a 2016 review that there was no evidence against Letby. However, senior doctors had been raising concerns for months after Letby had already killed five newborns and attempted to kill five others. Letby, who is expected to receive a whole-life term, making her only the third living woman to receive such a sentence, was cleared of two counts of attempted murder and jurors were unable to reach verdicts on six other charges. Consultants had reported Letby's connection to unusual deaths and collapses to executives in 2015, but no formal investigation was launched.",1,0,0.27610987223810113,0,1,0,0
