article_id,article_title,article_summary,skip_forwards,skip_backwards,average_skip_perc,listens,unique_users,saves,archives
f490dc0a-8cc9-4d14-a8ff-8e32e9e94c67,The word you’re looking for is “marketer.” - The Verge,"TikTok creators on MovieTok are clarifying that they are not critics. They often blur the line between promotional posts and honest reviews. Some creators promote movies for studios or accept gifts, while others avoid being too negative. Many reviewers prefer delivering negative opinions in the form of a compliment sandwich. This may be why studios are reaching out to influencers during the Hollywood strikes.",0,0,0.0,1,1,0,0
0901edaf-cd26-4de3-ad52-97bcaf85f32b,"Is it time to finally, absolutely leave Twitter / X? - The Verge","The article discusses the idea of leaving Twitter, particularly in light of the recent controversies and upheaval surrounding the social media platform and its owner, Elon Musk. It suggests that while some people are choosing to stay on Twitter, others are considering moving on. For those who are thinking of leaving, the article advises deleting all previous tweets before doing so. It also provides instructions on how to delete Twitter history. The article ends with links to other sections of The Verge website and information about the website's terms of use, privacy policy, and advertising opportunities.",0,0,0.0,1,1,0,0
5829ed4d-081d-4176-8cf7-c5d7a847067d,"Apple Vision Pro: visionOS, R1 chip, EyeSight, and more - The Verge","Apple has unveiled its Vision Pro headset, which runs on visionOS and uses two Apple Silicon chips. The headset offers natural control with hand and eye tracking, as well as voice commands. It will be available in the US early next year for $3,499. Apple has partnered with Pixar, Adobe, Nvidia, and Autodesk to promote open standards for 3D tools and data through the Alliance for OpenUSD. Developers can now apply for Vision Pro developer kits, which include support and guidance from Apple. Netflix has no plans to create a native app for the Vision Pro, opting to allow its existing iPad app to run on the headset. Apple plans to sell the Vision Pro headset on an appointment-only basis, with designated sections in stores for customers to try it on. The TestFlight app has been updated to support visionOS, indicating that developer kits may be shipped soon.",0,1,0.0,1,1,1,0
a57c9b20-8ca1-4b6d-a360-6bad5c8bbfbe,Bored Ape Yacht Club creator to block OpenSea in fight over payments - The Verge,"Yuga Labs, the company behind Bored Ape Yacht Club and CryptoPunks, announced that it will block the ability to trade its newer NFTs on OpenSea by February 2024. This is in response to OpenSea's decision to stop collecting royalties on behalf of NFT creators. The ability for creators to receive a cut every time their NFTs are resold was one of the promises of NFTs, but it is up to marketplaces like OpenSea to enforce and distribute those fees. OpenSea's decision to no longer collect resale fees has been a blow to Yuga Labs, as these fees have added up to tens of millions of dollars for them. The ban on OpenSea trading will only apply to newer NFTs, while older collections like Bored Ape Yacht Club and CryptoPunks will likely continue to be traded on the platform. OpenSea has announced that as of March 2024, all royalty fees for artists will be optional tips. Many NFT businesses rely on these fees as a way to make money. Yuga Labs has previously blocked transactions on marketplaces that don't enforce royalty fees.",0,0,0.0,1,1,0,0
4fbe8a7f-23dc-4f8b-9da0-6afdd89f1a1e,Tiffany Haddish on her new movie’s bleak vision of our streaming future - The Verge,"Tiffany Haddish stars in the sci-fi film ""Landscape With Invisible Hand,"" which explores a future where an alien species takes over the planet through economics rather than force. The aliens, called Vuuv, live in floating cities with the elite, while the rest of the population struggles on the surface. Livestreaming becomes a popular way to make money, with the Vuuv being particularly interested in watching young couples broadcast their lives. Haddish was drawn to the film because she found the premise believable. Set in the 2030s, Haddish plays a mother who relies on livestreaming income after losing her job as a lawyer. The film tackles themes of societal structures and the sacrifices people make to survive. Despite being a sci-fi film, the depiction of livestreaming is not far-fetched and resembles what is seen on platforms like Twitch and Instagram Live. Haddish admits to not fully understanding the appeal of livestreaming but recognizes its popularity and potential for the future.",1,0,0.7297009158819773,0,1,0,0
b465611f-1392-4833-bb21-67984f9e6cd1,It’s like if the Game Boy Advance SP was even tinier. - The Verge,"The FunKey S is a retro gaming console that is extremely tiny, resembling a smaller version of the Game Boy Advance SP. It comes in various colors, including the classic Atomic Purple from the late 90s-early 2000s. The console is capable of emulating consoles up to the original PlayStation. However, due to its small size, the gaming experience may not be the most enjoyable or long-lasting. The author of the article ordered one to see what games like Syphon Filter would look like on its 1.54-inch screen. The article concludes by emphasizing the tiny size of the console.",1,0,0.28304739075943713,0,1,0,0
59f7b9db-fd3b-4c79-b20e-5b4b2321f538,Here’s how Bambu will fix its 3D printers that began printing by themselves - The Verge,"Bambu is addressing the issue of its 3D printers printing by themselves and causing damage. The company has outlined several fixes in an official blog post. For the X1C printer, Bambu will introduce a firmware feature that verifies if a printed model has been removed before starting a new print. The P1 series printers will display reminders to clean the plate before printing. Bambu will also implement a feature that monitors the temperature and displays error messages if it detects abnormal heat. The company will discard outdated print requests and is working on other firmware fixes. Bambu has already updated its cloud server and is prioritizing these fixes. The company has taken quick action, taking responsibility, investigating the issue, and promising repairs. Bambu will assist customers in repairing damaged devices and provide spare parts and filament for wasted materials. Users affected by the issue are advised to contact Bambu's support team.",1,0,0.07716147167603915,0,1,0,0
d75f06d3-092e-4ccd-a390-269720af1a49,2009Scape - A free & open-source remake of 2009 era RuneScape,"2009Scape is a free and open-source remake of the 2009 era of RuneScape. The website features various sections including Home, Wiki, Drop Tables & More, Updates, Game, Community, Help, and Website Features. In the Game section, users can browse the game guide and access features such as the credit system and rules. The Community section provides access to forums, Discord and Matrix servers, hiscores, and the Hall of Fame. The Help section offers frequently asked questions and a bug report submission. The Website Features section includes options like getting started, viewing community hiscores, reporting bugs, experiencing RuneScape Classic with OpenRSC, and accessing the mobile client. The Latest Updates section highlights recent game updates, such as the Clock Tower Quest, Death Plateau, and Small Changes in Gielinor. The More Updates table showcases additional game updates, including Plague City, The Grand Update, and Introducing Global Chat. The website also encourages users to join their Discord server for community engagement.",1,0,0.6189900852443224,0,1,0,0
49c95bc7-8cd4-44a6-a1c2-f8904ff73d48,Ask vs guess culture - by Jean Hsu - Tech and Tea,"The text discusses the concept of ""ask culture"" versus ""guess culture"" and how it affects behavior and expectations in different situations. Ask culture is characterized by being direct and making requests even if they seem unreasonable, while guess culture involves reading indirect cues and only asking for something if you are already sure the other person will say yes. The text provides examples of how these cultures play out in a moving situation, with ask culture involving posting on social media and making a list of specific requests, while guess culture involves asking friends individually based on their availability and circumstances. The text suggests that understanding these cultural differences can help explain and navigate conflicts and frustrations in relationships.",1,0,0.17452075593543032,0,1,0,0
303318db-3c72-44ed-917d-af911da8757e,"
	Saying Hello Linked to Higher Wellbeing, but With Limits 
","A study conducted by researchers at the University of Cambridge found that saying hello to strangers is linked to higher wellbeing. The study involved participants who were instructed to either say hello or remain silent as they passed by strangers in public places. The results showed that those who said hello reported feeling happier and more connected to their community. However, the study also found that there are limits to the benefits of saying hello. When participants were asked to say hello to a large number of strangers, the positive effects diminished. This suggests that there is a threshold for the number of social interactions that can contribute to wellbeing. The researchers believe that these findings highlight the importance of small acts of kindness and social connections in daily life. They suggest that even brief interactions with strangers can have a positive impact on mental health and social cohesion. Additionally, a Gallup study found that regularly greeting multiple neighbors in the neighborhood is linked to higher wellbeing among adults in the U.S. The study showed that the wellbeing score of Americans increases as the number of neighbors greeted increases, with a peak at greeting six neighbors. Beyond six neighbors, there is no significant increase in wellbeing. The findings suggest that routine greetings to neighbors can positively impact mental health and social connectedness.",1,0,0.16263093043032753,0,1,0,0
ea115b9a-c73d-4dc6-a99f-3fcda6c1eba4,Radiation Spikes at Chernobyl: A Mystery Few Seem Interested in Solving,"Radiation sensors at the Chernobyl nuclear plant spiked after the Russian invasion of Ukraine. The cause of the spikes is unknown, but security researcher Ruben Santamarta believes the data was likely manipulated. He found suspicious patterns in the data that did not match normal radiation levels. Santamarta concluded that the most likely way for someone to alter the data was to write malicious code on the Ecocenter's server. The spikes occurred in clusters, with multiple sensors spiking simultaneously while others nearby showed no spike. If the spikes were caused by trucks stirring up radioactive dirt, the radiation levels would not have dropped so quickly. Despite the concerning findings, there has been little interest in investigating the issue further. Santamarta will be presenting his findings at the BlackHat security conference and releasing a research paper. The mystery of the radiation spikes at Chernobyl remains unsolved.",1,0,0.9010192948392607,0,1,0,0
87f22393-ef9d-4990-a096-4922801371b3,Quanta Magazine,"Complexity theorists have been on a long journey, starting with the P versus NP problem and now confronting the challenge of complexity theory itself. The P versus NP problem asks whether difficult computational problems can be solved easily or are truly hard. Despite decades of research, a resolution to this problem remains elusive. Complexity theorists have turned to meta-complexity, studying the difficulty of proving computational hardness and its connection to hidden patterns in random data. The historical context of the P versus NP problem includes David Hilbert's research program and Kurt Gödel's proof that undermined Hilbert's dream of a complete and consistent mathematical theory. Alan Turing's work further showed the limits of mathematics and computation. The text also discusses the hardness of problems, such as the Hamiltonian path problem, which becomes exponentially harder as the graph size increases. Complexity theorists continue to explore the uncharted landscape of computational complexity, seeking answers to fundamental questions about the nature of computation.",1,0,0.30309024000836765,0,1,0,0
9743945b-7636-4a4f-abb6-73b1e03f18de,Short session expiration does not help security,"The article discusses the effectiveness of short session expiration times in improving web application security. While current security advice suggests using short session timeouts, many popular web applications, such as Gmail and GitHub, do not adhere to this recommendation. The threat model involves an attacker gaining unauthorized access to a user's active session through various means, such as stealing session cookies or exploiting session fixation vulnerabilities. However, expiring the session after a short period of inactivity may not prevent session takeover, as attackers can immediately use stolen session tokens to gain access. The article also mentions the potential risk of shared computers and compromised devices, but states that for most web applications, the threat of shared public computers is not realistic. Additionally, even if an attacker gains access to a user's device, session expiration may not prevent them from creating a new session using password reset methods or other means. Overall, the effectiveness of short session expiration times in enhancing security is questioned.",1,0,0.14635879021722195,0,1,0,0
3fe14d1d-dba6-41fd-9871-c0247d2b575b,ARM’s Neoverse N2: Cortex A710 for Servers – Chips and Cheese,"ARM's Neoverse N2 is a server chip that builds on the success of its predecessor, Neoverse N1. It aims to continue ARM's foothold in the server marketplace. Neoverse N2 has similarities to the Cortex A710, with both having three ALU pipes to handle common operations. It is compared to AMD's Zen 4 and Intel's Sapphire Rapids, with Zen 4 having a density-focused variant and Sapphire Rapids focusing on per-core performance. Neoverse N2 has a 10-cycle pipeline and a branch predictor slightly less accurate than Zen 4's but compensates with fast and high-capacity BTBs. The execution unit count and memory access capabilities are well matched between the two architectures. Neoverse N2 has a locked clock speed of 2.75 GHz, but it can reach 3.2 GHz. It introduces SVE support for vector execution. Overall, Neoverse N2 shows promise in the server market, with its integer side performing well and improvements in scheduling capacity. However, Zen 4 has made more substantial progress in the vector/floating-point side compared to Neoverse N2.",1,0,0.1893195597588775,0,1,0,0
a851ad26-308a-473e-8712-9a1e1576f628,Pines’ demon observed as a 3D acoustic plasmon in Sr2RuO4 | Nature,"The first summary is about a study that found that exercise can help reduce the risk of developing depression. The second summary is about a study that found that exercise can improve mental health and well-being. The third summary is about a study that found that exercise can help alleviate symptoms of anxiety and depression. The fourth summary is about a study that found that exercise can help improve cognitive function and reduce the risk of developing dementia. The fifth summary is about a study that found that exercise can help improve sleep quality and reduce insomnia. Overall, these studies show that exercise is beneficial for mental health and can help prevent and alleviate various mental health conditions.",1,0,0.2549221933629945,0,1,0,0
1e44587a-3a8c-48e6-b56e-ebac84011690,Sargablock | for Tomorrow,"Sargablock is a construction material made from sargassum seaweed that washes up on Caribbean beaches. It has gained interest in countries across the Caribbean and beyond due to its potential to address the issue of sargassum seaweed and its impact on the tourism industry. The founder of Sargablock, Omar Vasquez, initially started collecting sargassum seaweed to use as fertilizer for his business and later realized its potential as a construction material. He developed a machine that can process a mix of 40% sargassum and 60% other organic materials to create Sargablocks. The machine can produce 1,000 blocks a day, which are dried and ready to be used after four hours of baking in the sun. Vasquez's vision is to build affordable housing throughout the Riviera Maya using Sargablocks and to create sustainable businesses that give back to the community. The project has gained attention from other countries facing similar issues with sargassum seaweed.",1,0,0.28885883063529977,0,1,0,0
c9f9f6b6-3ba2-4bf3-b398-022be618bc8d,GitHub - Textualize/textual: Textual is a Rapid Application Development framework for Python.  Build sophisticated user interfaces with a simple Python API. Run your apps in the terminal and (coming soon) a web browser!,"Textual is a Rapid Application Development framework for Python that allows users to build sophisticated user interfaces using a simple Python API. It enables users to run their applications in both the terminal and, in the future, a web browser. The framework is available on GitHub under the repository name ""Textualize/textual"" and is licensed under the MIT license. The repository has gained popularity, with 20.7k stars and 626 forks. The repository has also had recent activity, including 134 issues, 27 pull requests, and 1 project. However, there is a commit that does not belong to any branch on the repository and may belong to a fork outside of the repository. Overall, Textual provides a convenient and efficient way to develop Python applications with advanced user interfaces.",1,0,0.23958275063292064,0,1,0,0
2fe48f94-93c5-4f5f-841e-b67f2d694e55,Zaum - Wikipedia,"Zaum is a concept in Russian Futurist poetry involving linguistic experiments in sound symbolism and language creation. It was developed by poets Velimir Khlebnikov and Aleksei Kruchenykh. Zaum is a non-referential phonetic entity with its own ontology, consisting of neologisms that have no meaning. It is organized through phonetic analogy and rhythm and cannot contain onomatopoeia or psychopathological states. Kruchenykh created Zaum to convey the disorder of life by introducing disorder into language, while Khlebnikov believed it could help create a new universal language based on reason. Examples of Zaum include Kruchenykh's poem ""Dyr bul shchyl"" and Khlebnikov's ""language of the birds,"" ""language of the gods,"" and ""language of the stars."" Zaum poetry combines poetry, illustrations, and theory and has been created by poets such as Serge Segay and Rea Nikonova in modern times. Zaumism was a movement involved in visual arts, literature, poetry, theater, and graphic design, with anti-war politics and a rejection of prevailing art standards. It influenced later styles such as avant-garde, surrealism, and Pop Art.",1,0,0.02968902146934351,0,1,0,0
ab753490-98fc-4cae-bd58-a64e39eaf147,Learning Async Rust With Entirely Too Many Web Servers,"Summary 1: A new study suggests that the Earth's magnetic field could reverse more frequently than previously thought. Scientists have found evidence of a magnetic field reversal occurring about 42,000 years ago, much more recent than the previously estimated 780,000 years ago. This finding raises concerns about the potential impact of a magnetic field reversal on modern technology and society.

Summary 2: The Earth's magnetic field has weakened by about 9% over the past 170 years, according to satellite data. This weakening could be a sign of an upcoming magnetic field reversal, which occurs when the magnetic north and south poles switch places. Such a reversal could have significant consequences for our planet, including increased exposure to solar radiation and disruption of modern technology that relies on the magnetic field.

Summary 3: Scientists have discovered that the Earth's magnetic field is weakening 10 times faster than previously believed. The magnetic field protects the planet from harmful solar radiation and helps guide animal migrations. If the weakening continues at this rate, it could lead to a complete reversal of the magnetic poles within the next 2,000 years. This would have a profound impact on our planet, affecting everything from climate patterns to satellite technology.",1,0,0.25090701483120875,0,1,0,0
1963a20f-5605-4edb-9254-765890caa675,The Atlas of Economic Complexity,"The Atlas of Economic Complexity is a tool that measures the economic diversity and complexity of countries. It provides insights into a country's future economic growth potential and its ability to diversify its exports. The atlas uses a complexity index, which is based on the diversity and ubiquity of a country's export basket. Countries with a higher complexity index are more likely to experience sustained economic growth. The atlas also provides visualizations that show the evolution of a country's economic complexity over time. It highlights the importance of diversification and upgrading of industries for long-term economic development. The tool is used by policymakers, researchers, and businesses to understand the economic landscape of different countries and identify opportunities for economic growth and development. It can also help countries identify potential areas for collaboration and knowledge transfer to enhance their economic complexity. Overall, the Atlas of Economic Complexity is a valuable resource for understanding and analyzing the economic dynamics of countries.",1,0,0.32567142873873706,0,1,0,0
66f959ea-3302-4d57-b17f-cbd6497b662f,Emulating a CPU in C++ (6502) - YouTube,The video on YouTube demonstrates how to emulate a 6502 CPU using C++. The video is about the process of emulating a CPU and provides a tutorial on how to do it using the 6502 architecture. It explains the steps involved in creating the emulator and demonstrates the code in C++. The video also discusses the importance of understanding the CPU architecture and how it can be useful in various applications. It provides insights into the working of the CPU and highlights the benefits of emulating it. The video is created by an individual or a group of developers who aim to share their knowledge and expertise in CPU emulation. The video is part of a series of tutorials on emulating different CPUs and aims to educate and inspire others in the field of computer science and programming.,1,0,0.31262987204631126,0,1,0,0
29ca55bf-6f1f-4c57-9ed5-de69fd63fed5,Health CEOs hauled in $4 billion as inflation pinched workers,"In 2022, health care CEOs collectively earned $4 billion, despite the economic challenges caused by inflation. While the stock market had a bad year, health care stocks performed relatively well as the demand for care and prescriptions returned to pre-pandemic levels. This allowed CEOs of over 300 publicly traded health care companies to earn substantial sums of money. Although the $4 billion CEO haul was 11% lower than the previous year, it highlights the significant earnings of health care leaders compared to ordinary Americans. Moderna CEO Stéphane Bancel was the highest-paid CEO, earning nearly $400 million due to the global demand for the company's Covid-19 vaccine. The top 10 highest-paid CEOs earned a combined $1.4 billion, equivalent to the annual spending of the National Institutes of Health on drug abuse and addiction research. This disparity in earnings reflects the consequences of treating the health care industry as a business.",1,0,0.22308959142827353,0,1,0,0
2b97bdba-abf6-4a90-ad7c-4534b5cc28cd,"
Fixing the TPM: Hardware Security Modules Done Right
","The author of the text criticizes the TPM2.0 for being a bloated mess and overly complex. They argue that the TPM's hardware is a tiny general-purpose computer and suggest that allowing users to run arbitrary programs would simplify the TPM. However, they acknowledge the challenge of preventing users from loading code that extracts the TPM's secret. The author then introduces Microsoft Research's solution called DICE measured boot, which limits access to the device secret and instead gives derived secrets to the main program. This solution involves a main program, a bootloader, a key derivation function, a unique device secret, a compound device identity, and a latch. The boot sequence ensures that only the bootloader can read the device secret, and if the main program leaks its derived secret, fixing the vulnerability automatically changes the derived secret. The author concludes by noting that Microsoft may not have realized the power of their solution.",1,0,0.10465248946845666,0,1,0,0
